;Authors;Title;link
283;Yichuan Li, Kyumin Lee, Nima Kordzadeh, Brenton Faber, Cameron Fiddes, Elaine Chen, Kai Shu;Multi-Source Domain Adaptation with Weak Supervision for Early Fake News Detection;https://ieeexplore.ieee.org/document/9671592/
284;Shubhangi Rastogi, Shabeg Singh Gill, Divya Bansal;An Adaptive Approach for Fake News Detection in Social Media: Single vs Cross Domain;https://ieeexplore.ieee.org/document/9799131/
285;Jianhui Xie, Song Liu, Ruixin Liu, Yinghong Zhang, Yuesheng Zhu;SERN: Stance Extraction and Reasoning Network for Fake News Detection;https://ieeexplore.ieee.org/document/9414787/
286;Suyu Ouyang, Junping Du, Benzhi Wang, Bowen Yu, Yuhui Wang, Meiyu Liang;Federal Learning Based COVID-19 Fake News Detection With Deep Self-Attention Network;https://ieeexplore.ieee.org/document/9754663/
287;Pasi Shailendra, Rashmi M, Ramu S, Ram Mohana Reddy Guddeti;Fake News Detection in Hindi Using Embedding Techniques;https://ieeexplore.ieee.org/document/9864378/
288;Dilip Kumar Sharma, Priya Shrivastava, Sonal Garg;Utilizing Word Embedding and Linguistic Features for Fake News Detection;https://ieeexplore.ieee.org/document/9763294/
289;Jayashree Nair, S S Akhil, V Harisankar;Fake News Detection Model for Regional Language;https://ieeexplore.ieee.org/document/9824641/